tweet_id,user_id,retweet_from,user_name,user_location,post_date,user_bio,believes_legitimate,tweet_text_body
http://twitter.com/SGregoryjenkins/statuses/901724836497645568 ,1281623378, None , Pantalon ,  , 2017-08-27T08:35:28.000Z , Conservative and Proud White Woman Detest KKK and #Antifa Don't care for Feminazi's either #IStandWithTrump #MAGA , True , Black Lives Matter THUGS Blocking Emergency Crews From Reaching Hurricane Victims https://t.co/p6UeT415V6
http://twitter.com/GeorgiaKubesh/statuses/901741874565836801 ,430736552, None , Georgia Kubesh ," Rhinelander,Wisconsin ", 2017-08-27T09:43:11.000Z , I love photography and astrology. , True , Black Lives Matter THUGS Blocking Emergency Crews From Reaching Hurricane Victims https://t.co/wqCoVrPAUJ
http://twitter.com/nathanson57/statuses/901752907338575872 ,4218076636, None , Peter Nathanson ," Ile-de-France, France ", 2017-08-27T10:27:01.000Z ," PETER NATHANSON, an American bluesman from Boston, Massachusetts, USA, has his own unique and modern sound. This bluesman,is one of the best of his generation. ", True , Black Lives Matter THUGS Blocking Emergency Crews From Reaching Hurricane Victims https://t.co/aSu9wmsdVD
http://twitter.com/RobertBedo1/statuses/901771707568070656 ,488382884, None , Robert Bedo , Surprise  , 2017-08-27T11:41:43.000Z ," PETER NATHANSON, an American bluesman from Boston, Massachusetts, USA, has his own unique and modern sound. This bluesman,is one of the best of his generation. ", True , Black Lives Matter THUGS Blocking Emergency Crews From Reaching Hurricane Victims https://t.co/y1QXag7fvw
http://twitter.com/Patschef/statuses/901803966597521413 ,14129929, None , Patschef ,  , 2017-08-27T13:49:55.000Z ," PETER NATHANSON, an American bluesman from Boston, Massachusetts, USA, has his own unique and modern sound. This bluesman,is one of the best of his generation. ", True , Black Lives Matter THUGS Blocking Emergency Crews From Reaching Hurricane Victims https://t.co/6cxcaS34yd
http://twitter.com/ILoveAmerica888/statuses/901821949407485953 ,7.56696E+17, None , ILoveAmerica , United States , 2017-08-27T15:01:22.000Z , I'm an American Patriot and Love This Country.  Huge Trump Supporter. , True , Black Lives Matter THUGS Blocking Emergency Crews From Reaching Hurricane Victims - https://t.co/Iff9dSpibB via @Shareaholic
http://twitter.com/AMike4761/statuses/901825080837197824 ,2767680652, None , Mike Allen ," Welland, Canada ", 2017-08-27T15:13:49.000Z , A Canadian who supported Brexit then Trump and wants Canada to follow suit. A hater of Globalism. , True , Black Lives Matter THUGS Blocking Emergency Crews From Reaching Hurricane Victims - FlashAmericanNews  #ma4t  https://t.co/TziZDERdzG
http://twitter.com/AMike4761/statuses/901825080837197824 ,1324899366,2767680652, Covfefe Deplorable ,  , 2017-08-27T15:13:49.000Z , #MAGAx3  #MakeAmericaGreatAgain             One of the Original Deplorables   Reformed Deplorable Democrat #VotedForTrump  #Trump2020    #AmericaFirst , True , RT @AMike4761: Black Lives Matter THUGS Blocking Emergency Crews From Reaching Hurricane Victims - FlashAmericanNews  #ma4t  https://t.co/T
http://twitter.com/AMike4761/statuses/901825080837197824 ,1500110215,2767680652, Hubris Serendipity , Solar System , 2017-08-27T15:13:49.000Z , I tweet therefore I exist. Twitto ergo sum. Ex ore infantium et lactantium...  Ad Absurdum , True , RT @AMike4761: Black Lives Matter THUGS Blocking Emergency Crews From Reaching Hurricane Victims - FlashAmericanNews  #ma4t  https://t.co/T
http://twitter.com/AMike4761/statuses/901825080837197824 ,3033004077,2767680652, Saddle Up! ,  , 2017-08-27T15:13:49.000Z ," Conservative. 2nd Amendment, Socialist Libcrats will be blocked..America doesn't need you!! ", True , RT @AMike4761: Black Lives Matter THUGS Blocking Emergency Crews From Reaching Hurricane Victims - FlashAmericanNews  #ma4t  https://t.co/T
http://twitter.com/AMike4761/statuses/901825080837197824 ,7.671E+17,2767680652, Deplorable Lynne ," Maryland, USA ", 2017-08-27T15:13:49.000Z , Country lady tired of government  corruption. Formerly birdlady1949 until I lost all my passwords. Hoping to reconnect with you. I believe in Trump. , True , RT @AMike4761: Black Lives Matter THUGS Blocking Emergency Crews From Reaching Hurricane Victims - FlashAmericanNews  #ma4t  https://t.co/T
http://twitter.com/AMike4761/statuses/901825080837197824 ,273938671,2767680652, canadian ,  , 2017-08-27T15:13:49.000Z , Love all mankind unless you have an agenda for evil , True , RT @AMike4761: Black Lives Matter THUGS Blocking Emergency Crews From Reaching Hurricane Victims - FlashAmericanNews  #ma4t  https://t.co/T
http://twitter.com/AMike4761/statuses/901825080837197824 ,7.8053E+17,2767680652, Pokeyrosie ,  , 2017-08-27T15:13:49.000Z ," Educated, hardworking! ", True , RT @AMike4761: Black Lives Matter THUGS Blocking Emergency Crews From Reaching Hurricane Victims - FlashAmericanNews  #ma4t  https://t.co/T
http://twitter.com/AMike4761/statuses/901825080837197824 ,8.31633E+17,2767680652, Down Under Voice , Australia , 2017-08-27T15:13:49.000Z ," Proud Australian, Greek Orthodox, Father and love President Trump & President Putin ", True , RT @AMike4761: Black Lives Matter THUGS Blocking Emergency Crews From Reaching Hurricane Victims - FlashAmericanNews  #ma4t  https://t.co/T
http://twitter.com/AMike4761/statuses/901825080837197824 ,1367960106,2767680652, pr brooks , james island , 2017-08-27T15:13:49.000Z ," Proud Australian, Greek Orthodox, Father and love President Trump & President Putin ", True , RT @AMike4761: Black Lives Matter THUGS Blocking Emergency Crews From Reaching Hurricane Victims - FlashAmericanNews  #ma4t  https://t.co/T
http://twitter.com/AMike4761/statuses/901825080837197824 ,1418532182,2767680652, RedskinPride , Redskin Universe , 2017-08-27T15:13:49.000Z ," Honor, Family, Pride, Strength, Courage, Effort #RedskinsTweetTeam. Hail To The Redskins! the greatest pro football brand in sports history. #HTTR Please FBack ", True , RT @AMike4761: Black Lives Matter THUGS Blocking Emergency Crews From Reaching Hurricane Victims - FlashAmericanNews  #ma4t  https://t.co/T
http://twitter.com/AMike4761/statuses/901825080837197824 ,3265487640,2767680652, Deplorable Lothar , Kaleefornia , 2017-08-27T15:13:49.000Z ," I am a 20th century artifact. I micturate on pc, and flatulate in their direction! ", True , RT @AMike4761: Black Lives Matter THUGS Blocking Emergency Crews From Reaching Hurricane Victims - FlashAmericanNews  #ma4t  https://t.co/T
http://twitter.com/AMike4761/statuses/901825080837197824 ,924539689,2767680652, Kambei , Washington DC , 2017-08-27T15:13:49.000Z , Semper Fidelis , True , RT @AMike4761: Black Lives Matter THUGS Blocking Emergency Crews From Reaching Hurricane Victims - FlashAmericanNews  #ma4t  https://t.co/T
http://twitter.com/AMike4761/statuses/901825080837197824 ,7.93455E+17,2767680652, Arnold Ziegler , Costa Rica , 2017-08-27T15:13:49.000Z , Constitution POTUS FLOTUS USMC Veterans TermLimits AOPA PADI 2A NRA VoterID AmericaFirst DefundUN Benghazi ClimateHoax BREXIT #ThePartyOfCriminalsAndTraitors , True , RT @AMike4761: Black Lives Matter THUGS Blocking Emergency Crews From Reaching Hurricane Victims - FlashAmericanNews  #ma4t  https://t.co/T
http://twitter.com/AMike4761/statuses/901825080837197824 ,2502773038,2767680652, margaret bebe ,  , 2017-08-27T15:13:49.000Z , Constitution POTUS FLOTUS USMC Veterans TermLimits AOPA PADI 2A NRA VoterID AmericaFirst DefundUN Benghazi ClimateHoax BREXIT #ThePartyOfCriminalsAndTraitors , True , RT @AMike4761: Black Lives Matter THUGS Blocking Emergency Crews From Reaching Hurricane Victims - FlashAmericanNews  #ma4t  https://t.co/T
http://twitter.com/AMike4761/statuses/901825080837197824 ,8.47476E+17,2767680652, Brian Hill ," Edmonton, Alberta ", 2017-08-27T15:13:49.000Z , Constitution POTUS FLOTUS USMC Veterans TermLimits AOPA PADI 2A NRA VoterID AmericaFirst DefundUN Benghazi ClimateHoax BREXIT #ThePartyOfCriminalsAndTraitors , True , RT @AMike4761: Black Lives Matter THUGS Blocking Emergency Crews From Reaching Hurricane Victims - FlashAmericanNews  #ma4t  https://t.co/T
http://twitter.com/AMike4761/statuses/901825080837197824 ,8.49563E+17,2767680652, Chickn&Trumplins ," Tennessee, USA ", 2017-08-27T15:13:49.000Z ," Americans are like a herd of cattle. Once we concede to the herd mentality, we will be controlled by a tiny few... #stayawake #farmer  #MAGA #GOD #COUNTRY ", True , RT @AMike4761: Black Lives Matter THUGS Blocking Emergency Crews From Reaching Hurricane Victims - FlashAmericanNews  #ma4t  https://t.co/T
http://twitter.com/AMike4761/statuses/901825080837197824 ,4883801255,2767680652, chris bragdon ," New Hampshire, USA ", 2017-08-27T15:13:49.000Z , Trump is president finally!!!  2 all serv & police  ppl past & present thank u 4 'r service! If u don't support Trump don't follow me I will block u... , True , RT @AMike4761: Black Lives Matter THUGS Blocking Emergency Crews From Reaching Hurricane Victims - FlashAmericanNews  #ma4t  https://t.co/T
http://twitter.com/AMike4761/statuses/901825080837197824 ,7.56664E+17,2767680652, EV ,  , 2017-08-27T15:13:49.000Z , Trump is president finally!!!  2 all serv & police  ppl past & present thank u 4 'r service! If u don't support Trump don't follow me I will block u... , True , RT @AMike4761: Black Lives Matter THUGS Blocking Emergency Crews From Reaching Hurricane Victims - FlashAmericanNews  #ma4t  https://t.co/T
http://twitter.com/AMike4761/statuses/901825080837197824 ,3081651703,2767680652, Blessed ,  , 2017-08-27T15:13:49.000Z , Live Life to the Fullest...Enjoy your family....take time for yourself....Follow Jesus...MAGA...2nd Amendment Follower , True , RT @AMike4761: Black Lives Matter THUGS Blocking Emergency Crews From Reaching Hurricane Victims - FlashAmericanNews  #ma4t  https://t.co/T
http://twitter.com/AMike4761/statuses/901825080837197824 ,474784051,2767680652, Armed American. ," Oregon,USA ", 2017-08-27T15:13:49.000Z , Fear no man but God.Patriot Not ur Safe Space #MAGA111%#TrumpArmy #1A #2A#NRA#DraintheSwamp#NoKeyboardtoughguys , True , RT @AMike4761: Black Lives Matter THUGS Blocking Emergency Crews From Reaching Hurricane Victims - FlashAmericanNews  #ma4t  https://t.co/T
http://twitter.com/AMike4761/statuses/901825080837197824 ,7.08789E+17,2767680652, Klmunoz ,  , 2017-08-27T15:13:49.000Z , Huge Trump supporter! please don't add me to list!! I BLOCK ALL LIBTARDS!! FOOTBALL SEASON GO GREENBAY PACKERS!! , True , RT @AMike4761: Black Lives Matter THUGS Blocking Emergency Crews From Reaching Hurricane Victims - FlashAmericanNews  #ma4t  https://t.co/T
http://twitter.com/AMike4761/statuses/901825080837197824 ,8.3841E+17,2767680652, Suzanne Stahl , Michigan  , 2017-08-27T15:13:49.000Z , believe in hard work for #MAGA. woman that's supports all president but truly excited for my vote for Trump , True , RT @AMike4761: Black Lives Matter THUGS Blocking Emergency Crews From Reaching Hurricane Victims - FlashAmericanNews  #ma4t  https://t.co/T
http://twitter.com/AMike4761/statuses/901825080837197824 ,8.23215E+17,2767680652, Me ,  , 2017-08-27T15:13:49.000Z , Deplorable me Christian conservative NRA dog Luvr.TRUMPTRAIN 2020 , True , RT @AMike4761: Black Lives Matter THUGS Blocking Emergency Crews From Reaching Hurricane Victims - FlashAmericanNews  #ma4t  https://t.co/T
http://twitter.com/AMike4761/statuses/901825080837197824 ,1686159229,2767680652, Kev ,  , 2017-08-27T15:13:49.000Z ," HTTR,#RedskinsDrunkTeam #RedskinsDisciple #GoDuke #Birdland #Redvolution #LEGALIZEIT Always listening to the music!!! North Kak is Home ", True , RT @AMike4761: Black Lives Matter THUGS Blocking Emergency Crews From Reaching Hurricane Victims - FlashAmericanNews  #ma4t  https://t.co/T
http://twitter.com/AMike4761/statuses/901825080837197824 ,2663033660,2767680652, Hanna Mantour , United Kingdom , 2017-08-27T15:13:49.000Z , The truth hurts but someone has to tell it.  check out my facebook page , True , RT @AMike4761: Black Lives Matter THUGS Blocking Emergency Crews From Reaching Hurricane Victims - FlashAmericanNews  #ma4t  https://t.co/T
http://twitter.com/ndoles/statuses/901826691156336645 ,29834317, None , Norma Doles , Florida , 2017-08-27T15:20:12.000Z , The truth hurts but someone has to tell it.  check out my facebook page , True , Black Lives Matter THUGS Blocking Emergency Crews From Reaching Hurricane Victims - https://t.co/B5XjDLc9vY via @Shareaholic
http://twitter.com/GregHar59460712/statuses/901826708591960064 ,8.68951E+17, None , JGH FROM AZ ," Cave Creek, AZ ", 2017-08-27T15:20:17.000Z , Libertarian Conservative seeking major government change putting Americans 1st.  Business Owner. Proud family man. #MAGA followed by #GreatAmericans. , True , Black Lives Matter THUGS Blocking Emergency Crews From Reaching Hurricane Victims - https://t.co/HOHx1MaI7i via @Shareaholic
http://twitter.com/AMike4761/statuses/901825080837197824 ,8.68951E+17,2767680652, JGH FROM AZ ," Cave Creek, AZ ", 2017-08-27T15:13:49.000Z , Libertarian Conservative seeking major government change putting Americans 1st.  Business Owner. Proud family man. #MAGA followed by #GreatAmericans. , True , RT @AMike4761: Black Lives Matter THUGS Blocking Emergency Crews From Reaching Hurricane Victims - FlashAmericanNews  #ma4t  https://t.co/T
http://twitter.com/AMike4761/statuses/901825080837197824 ,431590274,2767680652, Flap Zappa ,  , 2017-08-27T15:13:49.000Z , One can only assume that many british voters have somehow been roofied as they have been royally shafted by corbyn. Put me on a list and get blocked , True , RT @AMike4761: Black Lives Matter THUGS Blocking Emergency Crews From Reaching Hurricane Victims - FlashAmericanNews  #ma4t  https://t.co/T
http://twitter.com/AMike4761/statuses/901825080837197824 ,828151412,2767680652, Irish Emerald , Trump/Cruz for President  , 2017-08-27T15:13:49.000Z ," Christian who wants USA back with opportunities for the honest, diligent, and educated.  Warning of the dangers for our daughters. ", True , RT @AMike4761: Black Lives Matter THUGS Blocking Emergency Crews From Reaching Hurricane Victims - FlashAmericanNews  #ma4t  https://t.co/T
http://twitter.com/AMike4761/statuses/901825080837197824 ,89064986,2767680652, Working Deplorable , Trans-Racial Individual , 2017-08-27T15:13:49.000Z ,  , True , RT @AMike4761: Black Lives Matter THUGS Blocking Emergency Crews From Reaching Hurricane Victims - FlashAmericanNews  #ma4t  https://t.co/T
http://twitter.com/AMike4761/statuses/901825080837197824 ,437191797,2767680652, Dovahkiin , Skyrim , 2017-08-27T15:13:49.000Z ," I am just me. I am strong-minded, strong-willed and quite bold when it comes to what is right & wrong. On the Trump Train... ", True , RT @AMike4761: Black Lives Matter THUGS Blocking Emergency Crews From Reaching Hurricane Victims - FlashAmericanNews  #ma4t  https://t.co/T
http://twitter.com/AMike4761/statuses/901825080837197824 ,8.23945E+17,2767680652, Larry Stevens ,  , 2017-08-27T15:13:49.000Z ," I am just me. I am strong-minded, strong-willed and quite bold when it comes to what is right & wrong. On the Trump Train... ", True , RT @AMike4761: Black Lives Matter THUGS Blocking Emergency Crews From Reaching Hurricane Victims - FlashAmericanNews  #ma4t  https://t.co/T
http://twitter.com/AMike4761/statuses/901825080837197824 ,8.40341E+17,2767680652, Juliette Lowe ,  , 2017-08-27T15:13:49.000Z ," Navy Vet, ""Retweets do not equal endorsements"" ", True , RT @AMike4761: Black Lives Matter THUGS Blocking Emergency Crews From Reaching Hurricane Victims - FlashAmericanNews  #ma4t  https://t.co/T
http://twitter.com/AMike4761/statuses/901825080837197824 ,4847689937,2767680652, Donald Dunlap ," Hell, is sufficient ", 2017-08-27T15:13:49.000Z ," An angry Old Man Who No Longer Cares to hear Frankfurt school falsehoods, and leftist garbage. But I Do STILL Block For Stupid. ", True , RT @AMike4761: Black Lives Matter THUGS Blocking Emergency Crews From Reaching Hurricane Victims - FlashAmericanNews  #ma4t  https://t.co/T
http://twitter.com/AMike4761/statuses/901825080837197824 ,8.11067E+17,2767680652, Wen ,  , 2017-08-27T15:13:49.000Z , Small business owner. Mother grandmother middle America  struggled for 8 years  drowning with Obama care works 2 jobs mother of 2 goldens constitutionalist , True , RT @AMike4761: Black Lives Matter THUGS Blocking Emergency Crews From Reaching Hurricane Victims - FlashAmericanNews  #ma4t  https://t.co/T
http://twitter.com/AMike4761/statuses/901825080837197824 ,15208303,2767680652, linkchips ," Langley, BC ", 2017-08-27T15:13:49.000Z , #Christian #conservative #Canadian. #prolife #commonsense #jtnotmypm , True , RT @AMike4761: Black Lives Matter THUGS Blocking Emergency Crews From Reaching Hurricane Victims - FlashAmericanNews  #ma4t  https://t.co/T
http://twitter.com/AMike4761/statuses/901825080837197824 ,16722647,2767680652, skull322 , Classified , 2017-08-27T15:13:49.000Z , Classified ////////////eyes only... , True , RT @AMike4761: Black Lives Matter THUGS Blocking Emergency Crews From Reaching Hurricane Victims - FlashAmericanNews  #ma4t  https://t.co/T
http://twitter.com/AMike4761/statuses/901825080837197824 ,16179166,2767680652, Diana White , The SOUTH (God's country!) , 2017-08-27T15:13:49.000Z , Legal eagle assistant.The Lord is my light & my salvation (Rom. 10:9-10). I love my fairly normal family! God Bless America! , True , RT @AMike4761: Black Lives Matter THUGS Blocking Emergency Crews From Reaching Hurricane Victims - FlashAmericanNews  #ma4t  https://t.co/T
http://twitter.com/AMike4761/statuses/901825080837197824 ,82616432,2767680652, Rep. of ," Mansfield, TX ", 2017-08-27T15:13:49.000Z ," Sinner saved by Grace. #Christian, Constitutional Conservative - LIMITED GOVT! #Texan, Musician, Teacher, Proud Husband & Father. ", True , RT @AMike4761: Black Lives Matter THUGS Blocking Emergency Crews From Reaching Hurricane Victims - FlashAmericanNews  #ma4t  https://t.co/T
http://twitter.com/AMike4761/statuses/901825080837197824 ,1069289803,2767680652, Joseph Campbell , TEXAS , 2017-08-27T15:13:49.000Z , Supporter of the US Constitution and Bill of Rights. Retired Veteran. Loves God. Proud not to support either political Party. Hates Tyranny. Loves Freedom. , True , RT @AMike4761: Black Lives Matter THUGS Blocking Emergency Crews From Reaching Hurricane Victims - FlashAmericanNews  #ma4t  https://t.co/T
http://twitter.com/AMike4761/statuses/901825080837197824 ,2194758303,2767680652, Juanita , Alabama , 2017-08-27T15:13:49.000Z , Supporter of the US Constitution and Bill of Rights. Retired Veteran. Loves God. Proud not to support either political Party. Hates Tyranny. Loves Freedom. , True , RT @AMike4761: Black Lives Matter THUGS Blocking Emergency Crews From Reaching Hurricane Victims - FlashAmericanNews  #ma4t  https://t.co/T
http://twitter.com/AMike4761/statuses/901825080837197824 ,8.23506E+17,2767680652, mark lee ," Lakeland, FL ", 2017-08-27T15:13:49.000Z , I am a redneck cracker. MAGA , True , RT @AMike4761: Black Lives Matter THUGS Blocking Emergency Crews From Reaching Hurricane Victims - FlashAmericanNews  #ma4t  https://t.co/T
http://twitter.com/AMike4761/statuses/901825080837197824 ,8.34842E+17,2767680652, Angelclimber2017 ,  , 2017-08-27T15:13:49.000Z , Honesty and Integrity. Schon and stark...#MAGAWA , True , RT @AMike4761: Black Lives Matter THUGS Blocking Emergency Crews From Reaching Hurricane Victims - FlashAmericanNews  #ma4t  https://t.co/T
http://twitter.com/littlrdragon/statuses/901827793897566209 ,7.33707E+17, None , Dennis ," North Carolina, USA ", 2017-08-27T15:24:35.000Z ," Pro-Trump, HRC Sucks, Retired, 20 yrs. Karate, Antique Car Restoration, AOPA ", True , Black Lives Matter THUGS Blocking Emergency Crews From Reaching Hurricane Victims - FlashAmericanNews - https://t.co/v0FskP7CFI via @Shareac
http://twitter.com/AMike4761/statuses/901825080837197824 ,178005137,2767680652, DAVE ROSA ," San Diego, CA ", 2017-08-27T15:13:49.000Z ," Vice-President Client Relations, Flat Fee Tax Service. Flat Fee Tax Service is the nationwide leader in having an IRS Levy stopped and released. ", True , RT @AMike4761: Black Lives Matter THUGS Blocking Emergency Crews From Reaching Hurricane Victims - FlashAmericanNews  #ma4t  https://t.co/T
http://twitter.com/AMike4761/statuses/901825080837197824 ,2364384368,2767680652, Gina Pavone , United States , 2017-08-27T15:13:49.000Z ," Vice-President Client Relations, Flat Fee Tax Service. Flat Fee Tax Service is the nationwide leader in having an IRS Levy stopped and released. ", True , RT @AMike4761: Black Lives Matter THUGS Blocking Emergency Crews From Reaching Hurricane Victims - FlashAmericanNews  #ma4t  https://t.co/T
http://twitter.com/AMike4761/statuses/901825080837197824 ,731467068,2767680652, Christine ," Florida, USA ", 2017-08-27T15:13:49.000Z , CRUSADER...PATRIOT....Proud Florida Trumpett...waiting with bated breath to #MAGA #TRUMPTRAIN , True , RT @AMike4761: Black Lives Matter THUGS Blocking Emergency Crews From Reaching Hurricane Victims - FlashAmericanNews  #ma4t  https://t.co/T
http://twitter.com/AMike4761/statuses/901825080837197824 ,52989817,2767680652, Isabelle H-Gustafson , Connecticut , 2017-08-27T15:13:49.000Z ," Love music/Singer/Event Coordinator/Designer,Military supporter/Libra-Oct 14th ", True , RT @AMike4761: Black Lives Matter THUGS Blocking Emergency Crews From Reaching Hurricane Victims - FlashAmericanNews  #ma4t  https://t.co/T
http://twitter.com/AMike4761/statuses/901825080837197824 ,24677438,2767680652, Casey ,  , 2017-08-27T15:13:49.000Z ," 25+ years in policy,legislative development.Worked for Ministers on both sides - 'enlightening'. Social Justice was born on the right.lists = instant block ", True , RT @AMike4761: Black Lives Matter THUGS Blocking Emergency Crews From Reaching Hurricane Victims - FlashAmericanNews  #ma4t  https://t.co/T
http://twitter.com/AMike4761/statuses/901825080837197824 ,8.85726E+17,2767680652, Tonikaczor ,  , 2017-08-27T15:13:49.000Z , Government & Politics US News News Politics , True , RT @AMike4761: Black Lives Matter THUGS Blocking Emergency Crews From Reaching Hurricane Victims - FlashAmericanNews  #ma4t  https://t.co/T
http://twitter.com/AMike4761/statuses/901825080837197824 ,4568989032,2767680652, Steve Baker ," Austin, TX ", 2017-08-27T15:13:49.000Z , Deplorded Constitutional Libertarian who loves BACON! , True , RT @AMike4761: Black Lives Matter THUGS Blocking Emergency Crews From Reaching Hurricane Victims - FlashAmericanNews  #ma4t  https://t.co/T
http://twitter.com/AMike4761/statuses/901825080837197824 ,1528566337,2767680652, peter nunn ,  , 2017-08-27T15:13:49.000Z ," im a normal bloke who loves our country, born and bred man utd. ", True , RT @AMike4761: Black Lives Matter THUGS Blocking Emergency Crews From Reaching Hurricane Victims - FlashAmericanNews  #ma4t  https://t.co/T
http://twitter.com/AMike4761/statuses/901825080837197824 ,7.42874E+17,2767680652, N_AmerSolutions , United States , 2017-08-27T15:13:49.000Z ," im a normal bloke who loves our country, born and bred man utd. ", True , RT @AMike4761: Black Lives Matter THUGS Blocking Emergency Crews From Reaching Hurricane Victims - FlashAmericanNews  #ma4t  https://t.co/T
http://twitter.com/AMike4761/statuses/901825080837197824 ,3524001795,2767680652, Stephanie Reed ,  , 2017-08-27T15:13:49.000Z , Republican.  MAGA  love our president!!#2020 #trump , True , RT @AMike4761: Black Lives Matter THUGS Blocking Emergency Crews From Reaching Hurricane Victims - FlashAmericanNews  #ma4t  https://t.co/T
http://twitter.com/AMike4761/statuses/901825080837197824 ,63219728,2767680652, PistolPackingInfidel ,  , 2017-08-27T15:13:49.000Z , #NRA Lifer I sit on my own fence! I share Thomas Jefferson's DNA #ProfessionalCatHerder  NO LISTS!! RT does not = endorsement , True , RT @AMike4761: Black Lives Matter THUGS Blocking Emergency Crews From Reaching Hurricane Victims - FlashAmericanNews  #ma4t  https://t.co/T
http://twitter.com/AMike4761/statuses/901825080837197824 ,3440646155,2767680652, Denise , HILLARY ORDERED:KILL SETH RICH , 2017-08-27T15:13:49.000Z , B.A. from Wellesley College; J.D. from U. Mass School of Law; Author; Artist; blogger; Pro-Life; Pro-Gun; ANTI-NWO/Luciferians; Christian. , True , RT @AMike4761: Black Lives Matter THUGS Blocking Emergency Crews From Reaching Hurricane Victims - FlashAmericanNews  #ma4t  https://t.co/T
http://twitter.com/gal_deplorable/statuses/901828305875238918 ,7.87661E+17, None , DeplorableMidwestGal , Middle America , 2017-08-27T15:26:37.000Z ," Christian, Patriot, Mother, Wife  Don't feed the trolls, let em starve. #MAGA #ENDTHECORRUPTION #StandWithIsrael #1A #2A  ", True , Black Lives Matter THUGS Blocking Emergency Crews From Reaching Hurricane Victims - https://t.co/RnnBxzCi1q
http://twitter.com/AMike4761/statuses/901825080837197824 ,499705581,2767680652, Peggy Callahan ," Bluffton, SC ", 2017-08-27T15:13:49.000Z ," Married, conservative, pro life all the way! Mother of 4 grown married children, 9 grand babies with 1 more on the way! I want to make America great for them! ", True , RT @AMike4761: Black Lives Matter THUGS Blocking Emergency Crews From Reaching Hurricane Victims - FlashAmericanNews  #ma4t  https://t.co/T
http://twitter.com/AMike4761/statuses/901825080837197824 ,260549383,2767680652, Canadians are dumb! ,  , 2017-08-27T15:13:49.000Z ," Married, conservative, pro life all the way! Mother of 4 grown married children, 9 grand babies with 1 more on the way! I want to make America great for them! ", True , RT @AMike4761: Black Lives Matter THUGS Blocking Emergency Crews From Reaching Hurricane Victims - FlashAmericanNews  #ma4t  https://t.co/T
